{
  "schemaVersion": "1.1.0",
  "packId": "READINESS-PACK-KAP-OPERATIONAL-CANDIDATE-2026-v1",
  "projectId": "PROJECT-KAP-OPENING-2026",
  "eventId": "EVENT-KAP-OPENING-2026",
  "venueId": "VENUE-KAP-001",
  "generatedAt": "2026-07-29T16:06:13+03:00",
  "actors": [
    {
      "actorRef": "ACTOR-AHMED-FOUNDER-PLATFORM",
      "displayNameAr": "أحمد",
      "actorType": "person",
      "classification": "founder-directed",
      "sourceTraceIds": [
        "TRACE-KAP-FOUNDER-AHMED-LIMITS"
      ],
      "founderDirectionReference": "TRACE-KAP-FOUNDER-AHMED-LIMITS",
      "assignmentScope": "رؤية المنصة واتجاه المنتج وقبول قدرة المنصة",
      "authorityLimitations": [
        "ليس سلطة عميل.",
        "ليس سلطة هندسية.",
        "ليس سلطة HSE أو مسارات.",
        "ليس سلطة افتتاح أو قبول تشغيلي نهائي."
      ]
    },
    {
      "actorRef": "ACTOR-KAP-IBRAHIM-AL-GHAMRI",
      "displayNameAr": "إبراهيم الغمري",
      "actorType": "person",
      "classification": "founder-directed",
      "sourceTraceIds": [
        "TRACE-KAP-FOUNDER-IBRAHIM",
        "TRACE-KAP-GOV-CONTENT-S3-S17"
      ],
      "founderDirectionReference": "TRACE-KAP-FOUNDER-IBRAHIM",
      "assignmentScope": "المحتوى الإبداعي",
      "authorityLimitations": [
        "تعيين مسار لا يمنح قبول عميل أو اعتماد تشغيل."
      ]
    },
    {
      "actorRef": "ACTOR-KAP-JOSEPH-HADDAD",
      "displayNameAr": "جوزيف حداد",
      "actorType": "person",
      "classification": "conflicting",
      "sourceTraceIds": [
        "TRACE-KAP-GOV-EXECUTION-S7-T1-R8"
      ],
      "founderDirectionReference": null,
      "assignmentScope": "مرشح مسؤول مسار التنفيذ في جدول مسؤوليات المسارات",
      "authorityLimitations": [
        "يتعارض مع مرشح المخطط التنظيمي.",
        "لا يحتسب ضمن تغطية مسؤول التنفيذ حتى حسم التعارض."
      ]
    },
    {
      "actorRef": "ACTOR-KAP-MAJED-QASIM",
      "displayNameAr": "ماجد قاسم",
      "actorType": "person",
      "classification": "founder-directed",
      "sourceTraceIds": [
        "TRACE-KAP-FOUNDER-MAJED",
        "TRACE-KAP-GOV-OPERATIONS-S3-S15"
      ],
      "founderDirectionReference": "TRACE-KAP-FOUNDER-MAJED",
      "assignmentScope": "مسار التشغيل",
      "authorityLimitations": [
        "تعيين مسار لا يمنح سلطة تحقق أو اعتماد أو افتتاح."
      ]
    },
    {
      "actorRef": "ACTOR-KAP-MUHAMMAD-IBRAHIM",
      "displayNameAr": "محمد إبراهيم",
      "actorType": "person",
      "classification": "conflicting",
      "sourceTraceIds": [
        "TRACE-KAP-FOUNDER-MUHAMMAD",
        "TRACE-KAP-GOV-EXECUTION-S3-S19",
        "TRACE-KAP-EMPLOYEE-MUHAMMAD-R28"
      ],
      "founderDirectionReference": "TRACE-KAP-FOUNDER-MUHAMMAD",
      "assignmentScope": "مرشح ممثل مشروع في المخطط التنظيمي، غير محسوم لمسار التنفيذ",
      "authorityLimitations": [
        "مرجع الموظف لا يثبت تعيينًا في المشروع.",
        "لا يحتسب ضمن تغطية مسؤول التنفيذ حتى حسم التعارض."
      ]
    },
    {
      "actorRef": "ROLE-KAP-CLIENT-DELIVERABLE-APPROVER",
      "displayNameAr": "مدير مشروع العميل مع المشرف العام للعميل",
      "actorType": "role",
      "classification": "source-backed",
      "sourceTraceIds": [
        "TRACE-KAP-GOV-APPROVAL-S4-S3-7"
      ],
      "founderDirectionReference": null,
      "assignmentScope": "اعتماد تسليمات العميل",
      "authorityLimitations": [
        "لا يثبت قبولًا تشغيليًا أو قرار افتتاح."
      ]
    },
    {
      "actorRef": "ROLE-KAP-DESIGN",
      "displayNameAr": "مسؤول التصميم",
      "actorType": "role",
      "classification": "source-backed",
      "sourceTraceIds": [
        "TRACE-KAP-GOV-WORKSTREAMS-S7-T1-R3-10"
      ],
      "founderDirectionReference": null,
      "assignmentScope": "التصميم",
      "authorityLimitations": [
        "تعيين المسار لا يثبت سلطة تحقق أو اعتماد."
      ]
    },
    {
      "actorRef": "ROLE-KAP-EVENT-MANAGER",
      "displayNameAr": "مدير الفعالية",
      "actorType": "role",
      "classification": "source-backed",
      "sourceTraceIds": [
        "TRACE-KAP-GOV-RACI-OPERATIONS-S6-T1-R3"
      ],
      "founderDirectionReference": null,
      "assignmentScope": "التسليمات التقنية والتشغيلية",
      "authorityLimitations": [
        "مسؤولية RACI لا تمنح اعتماد افتتاح."
      ]
    },
    {
      "actorRef": "ROLE-KAP-GUEST-EXPERIENCE",
      "displayNameAr": "مسؤول تجربة الضيف",
      "actorType": "role",
      "classification": "source-backed",
      "sourceTraceIds": [
        "TRACE-KAP-GOV-WORKSTREAMS-S7-T1-R3-10"
      ],
      "founderDirectionReference": null,
      "assignmentScope": "تجربة الضيف",
      "authorityLimitations": [
        "تعيين المسار لا يثبت سلطة تحقق أو اعتماد."
      ]
    },
    {
      "actorRef": "ROLE-KAP-HOSPITALITY",
      "displayNameAr": "مسؤول الضيافة",
      "actorType": "role",
      "classification": "source-backed",
      "sourceTraceIds": [
        "TRACE-KAP-GOV-WORKSTREAMS-S7-T1-R3-10"
      ],
      "founderDirectionReference": null,
      "assignmentScope": "الضيافة",
      "authorityLimitations": [
        "تعيين المسار لا يثبت سلطة تحقق أو اعتماد."
      ]
    },
    {
      "actorRef": "ROLE-KAP-INTERNAL-DELIVERABLE-APPROVER",
      "displayNameAr": "PMO والمشرف العام من ميادين",
      "actorType": "role",
      "classification": "source-backed",
      "sourceTraceIds": [
        "TRACE-KAP-GOV-APPROVAL-S4-S3-7"
      ],
      "founderDirectionReference": null,
      "assignmentScope": "اعتماد تسليمات داخلي",
      "authorityLimitations": [
        "اعتماد تسليمات فقط، وليس اعتماد جاهزية تشغيلية أو HSE."
      ]
    },
    {
      "actorRef": "ROLE-KAP-LOGISTICS-TRANSPORT",
      "displayNameAr": "مسؤول اللوجستيات والنقل",
      "actorType": "role",
      "classification": "source-backed",
      "sourceTraceIds": [
        "TRACE-KAP-GOV-WORKSTREAMS-S7-T1-R3-10"
      ],
      "founderDirectionReference": null,
      "assignmentScope": "اللوجستيات والنقل",
      "authorityLimitations": [
        "تعيين المسار لا يثبت سلطة تحقق أو اعتماد."
      ]
    },
    {
      "actorRef": "ROLE-KAP-PMO",
      "displayNameAr": "مكتب إدارة المشروع",
      "actorType": "role",
      "classification": "source-backed",
      "sourceTraceIds": [
        "TRACE-KAP-GOV-PMO-S3-S7"
      ],
      "founderDirectionReference": null,
      "assignmentScope": "تنسيق الحزمة والتوثيق",
      "authorityLimitations": [
        "ليس سلطة HSE أو فتح تشغيلية تلقائيًا."
      ]
    },
    {
      "actorRef": "ROLE-KAP-PROTOCOL-CROWD",
      "displayNameAr": "مسؤول البروتوكول والحشود",
      "actorType": "role",
      "classification": "source-backed",
      "sourceTraceIds": [
        "TRACE-KAP-GOV-WORKSTREAMS-S7-T1-R3-10"
      ],
      "founderDirectionReference": null,
      "assignmentScope": "البروتوكول والحشود",
      "authorityLimitations": [
        "تعيين المسار لا يثبت سلطة تحقق أو اعتماد."
      ]
    },
    {
      "actorRef": "ROLE-KAP-QUALITY-RISK",
      "displayNameAr": "مسؤول الجودة والمخاطر",
      "actorType": "role",
      "classification": "source-backed",
      "sourceTraceIds": [
        "TRACE-KAP-GOV-WORKSTREAMS-S7-T1-R3-10"
      ],
      "founderDirectionReference": null,
      "assignmentScope": "الجودة والمخاطر",
      "authorityLimitations": [
        "تعيين المسار لا يثبت سلطة تحقق أو اعتماد."
      ]
    }
  ],
  "workstreams": [
    {
      "workstreamId": "WORKSTREAM-KAP-GOVERNANCE",
      "labelAr": "الحوكمة وPMO",
      "labelEn": "Governance and PMO",
      "descriptionAr": "مسار الحوكمة وPMO المستخرج من مرجع الحوكمة أو الموجّه من المؤسس.",
      "order": 1,
      "classification": "source-backed",
      "sourceTraceIds": [
        "TRACE-KAP-GOV-WORKSTREAMS-S7-T1-R3-10"
      ],
      "owner": {
        "actorRef": "ROLE-KAP-PMO",
        "displayNameAr": "مكتب إدارة المشروع",
        "actorType": "role",
        "classification": "source-backed",
        "sourceTraceIds": [
          "TRACE-KAP-GOV-PMO-S3-S7"
        ],
        "founderDirectionReference": null,
        "assignmentScope": "تنسيق الحزمة والتوثيق",
        "authorityLimitations": [
          "ليس سلطة HSE أو فتح تشغيلية تلقائيًا."
        ]
      },
      "responsibleParty": {
        "actorRef": "ROLE-KAP-PMO",
        "displayNameAr": "مكتب إدارة المشروع",
        "actorType": "role",
        "classification": "source-backed",
        "sourceTraceIds": [
          "TRACE-KAP-GOV-PMO-S3-S7"
        ],
        "founderDirectionReference": null,
        "assignmentScope": "تنسيق الحزمة والتوثيق",
        "authorityLimitations": [
          "ليس سلطة HSE أو فتح تشغيلية تلقائيًا."
        ]
      },
      "unresolvedAssignmentIds": []
    },
    {
      "workstreamId": "WORKSTREAM-KAP-QUALITY-RISK",
      "labelAr": "الجودة والمخاطر",
      "labelEn": "Quality and risk",
      "descriptionAr": "مسار الجودة والمخاطر المستخرج من مرجع الحوكمة أو الموجّه من المؤسس.",
      "order": 2,
      "classification": "source-backed",
      "sourceTraceIds": [
        "TRACE-KAP-GOV-WORKSTREAMS-S7-T1-R3-10"
      ],
      "owner": {
        "actorRef": "ROLE-KAP-QUALITY-RISK",
        "displayNameAr": "مسؤول الجودة والمخاطر",
        "actorType": "role",
        "classification": "source-backed",
        "sourceTraceIds": [
          "TRACE-KAP-GOV-WORKSTREAMS-S7-T1-R3-10"
        ],
        "founderDirectionReference": null,
        "assignmentScope": "الجودة والمخاطر",
        "authorityLimitations": [
          "تعيين المسار لا يثبت سلطة تحقق أو اعتماد."
        ]
      },
      "responsibleParty": {
        "actorRef": "ROLE-KAP-QUALITY-RISK",
        "displayNameAr": "مسؤول الجودة والمخاطر",
        "actorType": "role",
        "classification": "source-backed",
        "sourceTraceIds": [
          "TRACE-KAP-GOV-WORKSTREAMS-S7-T1-R3-10"
        ],
        "founderDirectionReference": null,
        "assignmentScope": "الجودة والمخاطر",
        "authorityLimitations": [
          "تعيين المسار لا يثبت سلطة تحقق أو اعتماد."
        ]
      },
      "unresolvedAssignmentIds": []
    },
    {